name,product_line,architecture,memory,memory_type,cuda_cores,tensor_cores,rt_cores,boost_clock,tdp,memory_bandwidth,price_usd,description,image_url
GeForce RTX 5090,Consumer Desktop,Blackwell,32GB,GDDR7,21760,680,340,2.41 GHz,575W,1.8 TB/s,1999,"The flagship consumer GPU featuring 21,760 CUDA cores and 32GB of GDDR7 memory. Based on Blackwell architecture with 5th gen Tensor cores and 4th gen RT cores. Delivers over 2X performance increase over RTX 4090 in AI-accelerated scenarios. Features DLSS 4 with Multi-Frame Generation for up to 8X frame rate multiplication. Equipped with advanced vapor chamber cooling for efficient thermal management in a compact dual-slot form factor.",https://images2.thanhnien.vn/528068263637045248/2024/5/30/hacznwupeqqaswfs7lz4dc-1717079816597-17170798171761507917776.jpg
GeForce RTX 5080,Consumer Desktop,Blackwell,16GB,GDDR7,10752,336,168,2.62 GHz,360W,1.15 TB/s,999,"High-end consumer GPU with 10,752 CUDA cores and 16GB GDDR7 memory. Positioned for 4K gaming and professional content creation. 256-bit memory interface providing solid bandwidth. Includes full support for DLSS 4 with Multi-Frame Generation and advanced ray tracing via 4th gen RT cores. Approximately 10% more CUDA cores than RTX 4080 with improved power efficiency per core.",https://halinhcomputer.vn/uploads/images/nvidia-geforce-rtx-5080-gpu-32-gbps-gddr7-memory.jpg
GeForce RTX 5070 Ti,Consumer Desktop,Blackwell,16GB,GDDR7,8960,280,140,2.45 GHz,300W,912 GB/s,749,"Mid-to-high range GPU combining 8,960 CUDA cores with 16GB of GDDR7 memory. 256-bit memory bus providing excellent bandwidth for gaming at 1440p and 4K with DLSS. Features 280 Tensor cores for AI acceleration and 140 RT cores for advanced ray tracing. Positioned between RTX 5070 and RTX 5080, offering balanced performance for demanding workloads.",https://file.hstatic.net/200000722513/file/geforce_rtx_5070_ti_1024x1024.jpg
GeForce RTX 5070,Consumer Desktop,Blackwell,12GB,GDDR7,6144,192,96,2.51 GHz,250W,648 GB/s,549,"Mid-range GPU with 6,144 CUDA cores and 12GB GDDR7 memory over 192-bit interface. NVIDIA claims RTX 4090 equivalent performance at $549 MSRP through DLSS 4 Multi-Frame Generation. Features full Blackwell architecture benefits including 5th gen Tensor cores and 4th gen RT cores. Primary target for 1440p high-refresh gaming and content creation at competitive pricing.",https://songphuong.vn/Content/uploads/2025/01/VGA-Nvidia-GeForce-RTX-5070.webp
GeForce RTX 5060 Ti,Consumer Desktop,Blackwell,16GB/8GB,GDDR7,4608,144,72,2.3 GHz,180W,432 GB/s,379,"Upper-entry GPU offering 4,608 CUDA cores with optional 16GB or 8GB GDDR7 memory configurations. 128-bit memory interface limiting bandwidth but sufficient for 1080p-1440p gaming. Single-slot design with reasonable power draw. Suitable for gamers seeking next-gen features (DLSS 4, ray tracing) at entry-to-mid price points. Represents significant upgrade over previous generation equivalents.",https://images2.thanhnien.vn/528068263637045248/2025/2/27/nvidia-geforce-rtx-5060-ti-17406311550581492391183.jpg
GeForce RTX 5060,Consumer Desktop,Blackwell,8GB,GDDR7,3840,120,60,2.3 GHz,90W,320 GB/s,299,"Entry-level consumer GPU with 3,840 CUDA cores and 8GB GDDR7 memory. 128-bit interface on compact single-slot card with minimal 90W power draw. Enables 1080p gaming at high frame rates and light 1440p gaming. Features DLSS 4 support and 4th gen RT cores for entry-level ray tracing. Ideal budget option for gamers upgrading from older GPUs or building affordable gaming systems.",https://pcmarket.vn/media/news/361-thumb.jpg
GeForce RTX 5050,Consumer Desktop,Blackwell,8GB,GDDR6,2560,80,40,2.35 GHz,55W,320 GB/s,199,"Most affordable Blackwell GPU with 2,560 CUDA cores and 8GB GDDR6 memory. Extremely low 55W power draw allows passive or minimal active cooling. 128-bit memory interface. Optimized for 1080p gaming at smooth frame rates. Includes neural shaders and DLSS 4 support despite entry-level positioning. Perfect for budget-conscious gamers, HTPC builds, and system upgrades without PSU replacement.",https://cdn-media.sforum.vn/storage/app/media/tiz/rtx-5050-01.jpg
GeForce RTX 5090 Laptop,Consumer Laptop,Blackwell,24GB,GDDR7,10496,328,164,2.16 GHz,150W,671 GB/s,2500,"Mobile flagship with 10,496 CUDA cores and 24GB GDDR7 memory in 256-bit interface. Powers ultrathin gaming laptops with desktop-like performance and DLSS 4 with Multi-Frame Generation. Features advanced thermal optimization for mobile environments. 95-150W configurable power draw depending on thermal design of host laptop. Claimed to deliver RTX 4090 desktop performance at roughly half the power consumption.",https://file.hstatic.net/200000722513/file/vga_rtx_5090_1024x1024.jpg
GeForce RTX 5080 Laptop,Consumer Laptop,Blackwell,16GB,GDDR7,7680,240,120,2.06 GHz,140W,492 GB/s,1800,"High-performance mobile GPU with 7,680 CUDA cores and 16GB GDDR7 memory over 256-bit interface. Designed for premium gaming laptops targeting 1440p-4K gaming with DLSS upscaling. Power-efficient 140W TDP enables all-day battery life in gaming scenarios. Includes full Blackwell feature set with neural rendering and frame generation capabilities for exceptional visual quality.",https://file.hstatic.net/200000722513/file/nvidia-geforce-rtx-5080-1_1024x1024.jpg
GeForce RTX 5070 Ti Laptop,Consumer Laptop,Blackwell,12GB,GDDR7,5888,184,92,2.09 GHz,130W,355 GB/s,1400,"Upper-mid-range mobile GPU with 5,888 CUDA cores and 12GB GDDR7 memory. 192-bit interface balances performance and power efficiency with 130W TDP. Targets enthusiast gaming laptops for high refresh rate 1440p gameplay. Features advanced AI acceleration through Tensor cores and DLSS 4 super-resolution for improved frame rates without quality loss. Excellent thermal efficiency in compact mobile form factor.",https://file.hstatic.net/200000722513/file/nvidia-rtx-5070-ti__1__1024x1024.jpg
GeForce RTX 5070 Laptop,Consumer Laptop,Blackwell,12GB,GDDR7,5888,184,92,2.09 GHz,120W,355 GB/s,1200,"Mobile variant of RTX 5070 with 5,888 CUDA cores and 12GB GDDR7 memory. Optimized for lower power envelope at 120W compared to desktop variant. Delivers strong 1440p gaming performance with DLSS 4 support. 256-bit memory interface ensures adequate bandwidth for mobile gaming scenarios. Positioned for mid-range gaming laptops seeking balanced performance and battery longevity.",https://www.nemoitsolutions.com/wp-content/uploads/2025/01/NVDIA-GEFORCE-RTX-5070-nemo-it.webp
GeForce RTX 5060 Laptop,Consumer Laptop,Blackwell,8GB,GDDR7,3328,104,52,2.09 GHz,90W,213 GB/s,1099,"Entry-level mobile GPU with 3,328 CUDA cores and 8GB GDDR7 memory. Ultra-efficient 90W power draw enables passive or minimal cooling in thin laptops. 128-bit interface sufficient for 1080p gaming at high refresh rates. Includes DLSS 4 with frame generation for improved performance perception. Accessible option for casual gaming and content creation on ultraportable laptops.",https://static.tweaktown.com/news/1/0/102342_1_geforce-rtx-5060-laptop-benchmark-shows-30-improvement-over-the-4060_full.jpg
GeForce RTX 5050 Laptop,Consumer Laptop,Blackwell,8GB,GDDR7,2560,80,40,2.13 GHz,70W,160 GB/s,899,"Most efficient mobile GPU with 2,560 CUDA cores and 8GB GDDR7 memory. Extremely low 70W power consumption permits passive cooling and excellent battery life. Supports DLSS 4 and AI acceleration despite minimal power draw. Suitable for ultrabooks and thin laptops requiring light gaming and creative work. 128-bit memory interface. Enables entry-level laptop gaming without specialized thermal designs.",https://nghenhinvietnam.vn/uploads/global/quanghuy/2024/11/23/lenovo/nghenhin_lenovo_nvidia-rtx-4050-laptop_2.jpg
GeForce RTX 4090,Consumer Desktop,Ada,24GB,GDDR6X,16384,512,256,2.52 GHz,450W,1.46 TB/s,1799,"Previous generation flagship still available in limited quantities. Features 16,384 CUDA cores with 24GB GDDR6X memory over 512-bit interface. Based on Ada Lovelace architecture with mature 3rd gen RT cores and 4th gen Tensor cores. Remains capable for demanding 4K gaming and professional work despite being superseded. DLSS 3 with frame generation support. Represents mature, battle-tested platform with extensive software optimization.",https://www.nvidia.com/content/dam/en-zz/Solutions/geforce/ada/rtx-4090/geforce-ada-4090-web-og-1200x630.jpg
GeForce RTX 4080 Super,Consumer Desktop,Ada,16GB,GDDR6X,10240,320,160,2.55 GHz,320W,720 GB/s,1199,"Refresh of RTX 4080 with minor specification improvements. 10,240 CUDA cores with 16GB GDDR6X memory. 256-bit interface. Primarily available through AIB partners in limited stock as RTX 50 series ramps up. Good value proposition for 4K gaming at lower cost than RTX 5080 launch price. Mature driver support and proven performance across gaming library.",https://www.nvidia.com/content/dam/en-zz/Solutions/geforce/ada/rtx-4080/geforce-rtx-4080-super-og-1200x630.jpg
GeForce RTX 4080,Consumer Desktop,Ada,16GB,GDDR6X,10240,320,160,2.50 GHz,320W,720 GB/s,1099,"Original RTX 40 series high-end GPU with 10,240 CUDA cores and 16GB GDDR6X memory. Positioned for 4K gaming and professional applications. 256-bit memory interface. Original launch model being phased out but still available through limited stock. Strong ecosystem of optimized games and creative software. DLSS 3 support with frame generation. Excellent alternative to RTX 5080 for value-conscious buyers.",https://cdn.tgdd.vn//News/0//tim-hieu-card-do-hoa-moi-ra-mat-rtx-4080-chi-tiet-01-800x450-1.png
GeForce RTX 4070 Ti Super,Consumer Desktop,Ada,16GB,GDDR6X,8960,280,140,2.61 GHz,285W,576 GB/s,899,"Refresh of RTX 4070 Ti with improved specifications. 8,960 CUDA cores with 16GB GDDR6X memory over 192-bit interface. Released January 2024. Targets enthusiasts seeking high-end performance without flagship price. Limited remaining stock as RTX 50 series displaces it. DLSS 3 and ray tracing support. Strong 1440p and 4K gaming performance at reduced thermal output compared to RTX 4080.",https://cdn.wccftech.com/wp-content/uploads/2023/11/NVIDIA-GeForce-RTX-4070-Ti-SUPER-GPU-Main-g-standard-scale-4_00x-Custom.png
GeForce RTX 4070 Super,Consumer Desktop,Ada,12GB,GDDR6X,5888,184,92,2.48 GHz,220W,504 GB/s,699,"Refresh of RTX 4070 released January 2024. 5,888 CUDA cores with 12GB GDDR6X memory over 192-bit interface. Excellent power efficiency per core. Positions between RTX 4070 and RTX 4070 Ti in performance hierarchy. Good 1440p gaming performance. Limited availability as RTX 50 series takes market share. DLSS 3 support. Remaining inventory provides good value alternative to RTX 5070.",https://www.nvidia.com/content/dam/en-zz/Solutions/geforce/graphic-cards/40-series/rtx-4070-4070ti/geforce-rtx-4070-super-og-1200x630.jpg
GeForce RTX 4070,Consumer Desktop,Ada,12GB,GDDR6X,5888,184,92,2.48 GHz,200W,504 GB/s,599,"Original RTX 40 series mid-range GPU with 5,888 CUDA cores and 12GB GDDR6X memory. Released April 2023. Primarily replaced by RTX 5070 but available in limited quantities. 192-bit memory interface. Targets 1440p gaming at high frame rates with ray tracing enabled. Mature software ecosystem with extensive game optimization. DLSS 3 support. Good value for users prioritizing proven performance over cutting-edge.",https://encrypted-tbn0.gstatic.com/images?q=tbn:ANd9GcS2dR-aM1jnZRYt9z_aCbswQLWwzvjMKQcaqg&s
GeForce RTX 4060 Ti,Consumer Desktop,Ada,16GB/8GB,GDDR6,4608,144,72,2.55 GHz,165W,288 GB/s,449,"Entry-mid GPU still in production with 4,608 CUDA cores. Offered in 16GB or 8GB GDDR6 configurations over 128-bit interface. Based on Ada architecture. Perfect for 1080p gaming at maximum settings with ray tracing and DLSS 3. Still relevant for light 1440p gaming. 165W power draw suitable for most PSUs. Ray tracing capable at entry level. Continued availability makes it accessible budget option.",https://www.nvidia.com/content/dam/en-zz/Solutions/geforce/ada/rtx-4060-4060ti/geforce-rtx-4060-ti-og-1200x630.jpg
GeForce RTX 4060,Consumer Desktop,Ada,8GB,GDDR6,3584,112,56,2.46 GHz,115W,288 GB/s,299,"Entry-level GPU continuing production. 3,584 CUDA cores with 8GB GDDR6 memory over 128-bit interface. Excellent 1080p gaming at high frame rates and settings. Ray tracing support through 3rd gen RT cores. Minimal 115W power requirement enables passive PSU sizing. Includes DLSS 3 support for enhanced performance perception. Most affordable path to modern GPU features. Ideal for budget builders and system upgrades.",https://s2-techtudo.glbimg.com/P34uTrH-Qk6_Yn8Ux9-C6aX7j4s=/1200x/smart/filters:cover():strip_icc()/i.s3.glbimg.com/v1/AUTH_08fbf48bc0524877943fe86e43087e7a/internal_photos/bs/2023/3/l/JzjLLhQf64MQw9OW9WuA/4060.png
H200 Tensor Core GPU,Data Center,Hopper,141GB,HBM3e,14080,440,N/A,1.44 GHz,700W,4.8 TB/s,35000,"Latest Hopper data center accelerator featuring revolutionary 141GB HBM3e memory—nearly double H100 capacity—with 4.8 TB/s bandwidth (1.4X H100). First GPU with HBM3e technology. 14,080 CUDA cores optimized for AI inference and training. Delivers 2X LLM inference performance improvement over H100. Excellent for long-context models and memory-intensive workloads. Preferred choice for generative AI deployment scaling and scientific computing with massive datasets.",https://www.nvidia.com/content/dam/en-zz/Solutions/Data-Center/h200/h200-tensor-og.jpg
H100 Tensor Core GPU,Data Center,Hopper,80GB,HBM3,18176,528,N/A,1.41 GHz,700W,3.35 TB/s,25000,"Proven Hopper generation data center workhorse with 18,176 CUDA cores and 80GB HBM3 memory. 4th gen Tensor cores with Transformer Engine for mixed-precision AI workloads. Industry-standard platform with extensive software optimization and cloud provider availability. Used across most major cloud providers (AWS, GCP, Azure). Excellent for large-scale model training and inference. Mature ecosystem with extensive application support.",https://www.nvidia.com/content/dam/en-zz/Solutions/gtcs22/data-center/h100/h100-og.jpg
H100 NVL,Data Center,Hopper,94GB,HBM3,18176,528,N/A,1.41 GHz,700W,3.35 TB/s,32000,H100 variant with NVLink interconnect featuring additional 14GB of memory. Designed for multi-GPU inference and training with ultra-low latency communication. NVLink enables efficient scaling to hundreds of GPUs. Highest performing multi-GPU configurations benefit significantly from NVLink bandwidth. Premium pricing reflects specialized interconnect. Preferred for large-scale training operations and inference clusters requiring coordinated compute.,https://encrypted-tbn0.gstatic.com/images?q=tbn:ANd9GcSoiKiBf3zUZcnhVpibxNdkan3NS2tVy6lwXA&s
A100 Tensor Core GPU,Data Center,Ampere,40GB/80GB,HBM2e,8192,432,N/A,1.41 GHz,250W/300W,1.935 TB/s,12000,"Mature Ampere generation data center GPU offering 8,192 CUDA cores in 40GB or 80GB HBM2e configurations. 3rd gen Tensor cores with 312 TFLOPS FP16 performance. Multi-Instance GPU (MIG) support enables partitioning into seven isolated instances for flexible workload distribution. Still widely available through cloud providers for legacy workload support. Excellent price-to-performance for AI inference. Proven reliability across production deployments worldwide.",https://mjenzi.com/wp-content/uploads/2024/07/h100-og.jpg
B200 Tensor Core GPU,Data Center,Blackwell,192GB,HBM3e,21120,528,N/A,1.98 GHz,1000W,8 TB/s,45000,"Next-generation Blackwell data center accelerator featuring dual-chip design with 192GB HBM3e memory and 8 TB/s bandwidth (2.4X H100). 21,120 CUDA cores with 5th gen Tensor cores supporting FP4 and FP6 ultra-low precision formats. 5th gen NVLink enables efficient multi-GPU scaling. Delivers 3X training performance and 15X inference performance vs H100. Addresses latest challenges in multi-modal AI and large language model inference at scale.",https://external-preview.redd.it/nvidia-reveals-blackwell-b200-gpu-the-worlds-most-powerful-v0-n0ndAKyCJwhGdmM-lVAHjaoaoeBH0EaoTckYSxxdzpo.jpg?width=640&crop=smart&auto=webp&s=98e158fda412c5fcd5f013d28d65f273f22739f9
L40S GPU,Data Center,Ada,48GB,GDDR6,18176,568,142,2.55 GHz,290W,864 GB/s,9000,"Universal data center accelerator based on Ada architecture with 18,176 CUDA cores and 48GB GDDR6 ECC memory. 4th gen Tensor cores deliver 733 TFLOPS FP8 and 91.6 TFLOPS FP32 performance. 3rd gen RT cores enable real-time graphics rendering and ray tracing. PCIe interface for easy integration into existing servers. Dual-slot full-height form factor. Excellent for graphics workloads, AI inference, and video processing simultaneously. More memory efficient than pure compute cards for diverse workloads.",https://www.nvidia.com/content/dam/en-zz/Solutions/gtcf22/l40/proviz-l40-og.jpg
L40 GPU,Data Center,Ada,48GB,GDDR6,18176,568,142,2.50 GHz,290W,864 GB/s,8000,"Standard variant of L40S with nearly identical specifications. 18,176 CUDA cores and 48GB GDDR6 ECC memory over full-height dual-slot form factor. Designed for graphics, visualization, and AI inference acceleration in data centers. 4th gen Tensor cores and 3rd gen RT cores. Primary differentiation from L40S involves minor clock speed variations and specific optimization profiles. PCIe interface for broad server compatibility. Excellent choice for heterogeneous data center workloads combining graphics and compute.",https://encrypted-tbn0.gstatic.com/images?q=tbn:ANd9GcSD6rkevCbQSfbrXXfIlX_uUtCrzXk6I02CdA&s
L4 GPU,Data Center,Ada,24GB,GDDR6,6144,192,142,2.51 GHz,72W,300 GB/s,3500,"Power-efficient inference accelerator with 6,144 CUDA cores and 24GB GDDR6 memory. Extremely low 72W TDP enables multiple cards per server without excessive power overhead. 4th gen Tensor cores deliver 242 TFLOPS tensor performance. Excellent density for large-scale inference deployment across data center infrastructure. PCIe 4.0 interface. Supports multiple concurrent inference streams. Most cost-effective solution for transformer inference at scale. Ideal for edge AI and cloud inference services.",https://encrypted-tbn0.gstatic.com/images?q=tbn:ANd9GcTgYZETNdbtZFqZD5s5HVUVg_W9koNfP_AETA&s
T4 Tensor Core GPU,Data Center,Turing,16GB,GDDR6,2560,320,N/A,1.59 GHz,70W,320 GB/s,2000,"Legacy Turing generation inference accelerator with 2,560 CUDA cores and 16GB GDDR6 memory. Released in 2018, still available through cloud providers for existing workloads. 70W power consumption permits many cards per server. 4th gen Tensor cores specialized for inference. Limited performance vs modern L4 and newer options but proven reliable in production. Good for cost-sensitive inference of smaller models. Supported extensively across cloud platforms.",https://www.nvidia.com/content/dam/en-zz/Solutions/Data-Center/tesla-t4/T4-LinekdIn-TW_SharedImage_2048x1024.jpg
RTX Pro 6000 Blackwell,Professional Desktop,Blackwell,96GB,GDDR7,24064,440,220,2.62 GHz,600W,1.79 TB/s,7700,"Flagship professional workstation GPU with 24,064 CUDA cores and 96GB GDDR7 memory. 5th gen Tensor cores with FP4 support for local LLM acceleration and AI prototyping. 4th gen RT cores with 2X performance for photorealistic rendering. Neural graphics technologies enable 100X more ray-traced triangles. Exceptional for agentic AI, 3D modeling, 8K video editing, and scientific visualization. DisplayPort 2.1b for driving 8K at 240Hz displays.",https://www.nvidia.com/content/nvidiaGDC/us/en_US/products/workstations/professional-desktop-gpus/rtx-pro-6000-family/_jcr_content/root/responsivegrid/nv_container_1907901/nv_container/nv_teaser_copy.coreimg.100.1070.jpeg/1753249509262/nvidia-workstation-rtx-pro-6000-ari.jpeg
RTX Pro 6000 Blackwell Max-Q,Professional Desktop,Blackwell,96GB,GDDR7,24064,440,220,2.62 GHz,440W,1.79 TB/s,7700,Power-optimized variant of RTX Pro 6000 Blackwell for mobile workstations and compact designs. Maintains full compute performance with reduced thermal envelope (440W vs 600W). Enables deployment in thin mobile workstations without specialized cooling. 96GB GDDR7 memory with 5th gen Tensor cores and 4th gen RT cores. Identical compute capabilities to full variant with efficient thermal design. Target market is professionals requiring desktop-class performance in portable systems.,https://www.nvidia.com/content/dam/en-zz/Solutions/products/workstations/professional-desktop-gpus/rtx-pro-6000-max-q/nvidia-geforce-rtx-pro-6000-og-1200x630.jpg
RTX Pro 6000 Blackwell Server,Data Center,Blackwell,96GB,GDDR7,24064,440,220,2.62 GHz,600W,1.79 TB/s,8500,"Server-variant RTX Pro 6000 for data center deployment. SXM form factor enables efficient multi-GPU configurations with NVLink-style interconnects in specialized servers. Supports MIG partitioning for workload isolation. Full performance with 5th gen Tensor cores and 4th gen RT cores. 96GB GDDR7 memory. Optimized for enterprise visualization, rendering farms, and distributed AI inference. Available through major cloud providers including AWS, Google Cloud, Microsoft Azure, and CoreWeave.",https://encrypted-tbn0.gstatic.com/images?q=tbn:ANd9GcStULFTF845u9jtjaGaiLHnDITh3OrYybw8Gg&s
RTX Pro 5000 Blackwell,Professional Desktop,Blackwell,24GB,GDDR7,8192,256,128,1.95 GHz,360W,1.02 TB/s,3700,"Mid-to-high professional GPU with 8,192 CUDA cores and 24GB GDDR7 memory. Single-slot form factor with efficient 360W power draw. 5th gen Tensor cores for AI model development and DLSS 4 support. 4th gen RT cores for advanced ray tracing in professional visualization. Excellent for smaller engineering teams and individual professionals requiring powerful workstation acceleration. Balanced between cost and performance for professional workflows.",https://www.nvidia.com/content/dam/en-zz/Solutions/products/workstations/professional-desktop-gpus/rtx-pro-5000-blackwell/nvidia-workstation-rtx-pro-5000-og-1200x630.jpg
RTX Pro 4500 Blackwell,Professional Desktop,Blackwell,24GB,GDDR7,6144,192,96,1.93 GHz,290W,768 GB/s,2300,"Upper-mid-range professional GPU with 6,144 CUDA cores and 24GB GDDR7 memory. Compact single-slot design with 290W power draw. 5th gen Tensor cores for moderate AI acceleration. 4th gen RT cores for real-time ray tracing in creative applications. Suitable for mid-size design teams and studios. Good balance of performance and affordability for professional graphics and visualization work. Supports DLSS 4 for enhanced rendering performance.",https://encrypted-tbn0.gstatic.com/images?q=tbn:ANd9GcSfflbKB1Mnl41KvGjZMCS5MVYL10lf9C7MjQ&s
RTX Pro 4000 Blackwell,Professional Desktop,Blackwell,24GB,GDDR7,4608,144,72,1.91 GHz,215W,576 GB/s,1400,"Entry-professional GPU with 4,608 CUDA cores and 24GB GDDR7 memory. Single-slot compact form factor with minimal 215W power consumption. 5th gen Tensor cores enabling AI features in professional software. 4th gen RT cores for real-time ray tracing in design applications. Target market is small studios and individual professionals. Excellent entry point to professional-class tools and optimizations. More affordable than higher-tier models while retaining modern Blackwell architecture benefits.",https://www.nvidia.com/content/dam/en-zz/Solutions/data-center/rtx-pro-4000-blackwell/nvidia-workstation-rtx4000-og-1200x630.jpg
RTX Pro 6880 Ada,Professional Desktop,Ada,48GB,GDDR6,13824,432,108,2.50 GHz,550W,1.46 TB/s,5500,"High-end Ada professional GPU with 13,824 CUDA cores and 48GB GDDR6 ECC memory. Dual-slot form factor. Based on mature Ada architecture. 3rd gen Tensor cores and 3rd gen RT cores. Excellent for high-end visualization, rendering, and scientific computing. Being phased out as Blackwell professional variants enter market. Limited availability through AIB partners. Proven performance across extensive professional software ecosystem.",https://encrypted-tbn0.gstatic.com/images?q=tbn:ANd9GcQfZ1pfeaECEv0SywrxPOI4q3V3c64TbLV4hQ&s
RTX Pro 6000 Ada,Professional Desktop,Ada,48GB,GDDR6,18176,568,142,2.50 GHz,290W,1.46 TB/s,6800,"Mature Ada flagship professional GPU with 18,176 CUDA cores and 48GB GDDR6 ECC memory. Dual-slot full-height form factor. 4th gen Tensor cores and 3rd gen RT cores from Ada architecture. Excellent performance across professional visualization, rendering, and VFX workflows. Extensive software ecosystem optimization. Being replaced by RTX Pro 6000 Blackwell variants. Still available through some vendors. Strong choice for studios with Ada software investments.",https://www.nvidia.com/content/nvidiaGDC/eu/en_EU/products/workstations/rtx-6000/_jcr_content/root/responsivegrid/nv_container_4363795/nv_tabs/item_1670486338733/nv_container/nv_container_copy/nv_teaser_copy_68232.coreimg.100.1070.jpeg/1728911877925/video-rtx-2560x1440.jpeg
RTX Pro 5880 Ada,Professional Desktop,Ada,24GB,GDDR6,9216,288,72,2.50 GHz,320W,768 GB/s,3400,"Mid-range Ada professional GPU with 9,216 CUDA cores and 24GB GDDR6 ECC memory. Single-slot design with 320W power draw. Based on Ada Lovelace architecture. Provides excellent performance for mid-sized design and engineering teams. 4th gen Tensor cores and 3rd gen RT cores. Being discontinued as Blackwell variants launch. Remaining stock available at reduced pricing. Good value for cost-conscious professional deployments.",https://www.servethehome.com/wp-content/uploads/2024/01/NVIDIA-RTX-5880-Ada.jpg
RTX Pro 5000 Ada,Professional Desktop,Ada,24GB,GDDR6,12800,400,100,2.50 GHz,250W,1.02 TB/s,3700,"Entry-high professional GPU with 12,800 CUDA cores and 24GB GDDR6 ECC memory. Single-slot compact form factor with low 250W power consumption. Based on Ada Lovelace architecture with 4th gen Tensor cores and 3rd gen RT cores. Excellent for individual professionals and small teams. Being phased out by Blackwell variants. Limited availability through some vendors. Strong performance relative to cost for professional visualization and design work.",https://www.jarcomputers.com/images/custom/site/Screenshot%202025-05-13%20at%2008-56-05%20nvidia-rtx-5000-ada-dark-background_jpg%20(JPEG%20Image%201920%20%C3%97%201080%20pixels)%20%E2%80%94%20Scaled%20(93%25).png
